ID,text,target,stance,stance:confidence,against_reason,favor_reason,none_reason,sarcasm,sarcasm:confidence,sentiment,sentiment:confidence,datetime,Date
3401, لا تستطيع تلبية احتياجات مواطنينها كيف لها ان توفر احتياجات التحول للعمل الالكتروني بكافة الجهات الحكومية 🤔,Digital Transformation,Against,0.5982,A_Explicit,,,No,1.0,Negative,0.7623,2021-09-03 21:39:00+00:00,03/09/2021
3403,توي اخذت تطعيم كورونا ( فايزر )  في مركز معارض الرياض ، شغل جبار وتنظيم رهيب ، غير اني استغرقت فقط ٢٠ دقيقة ، هذا وانا جاي الساعة 10 يعني عز الزحمة ، ولكن ماشاء الله جهد جبار #السعودية #كورونا #فايزر,Covid Vaccine,None,1.0,,,Not clear,Yes,1.0,Positive,1.0,2021-04-18 19:55:45+00:00,18/04/2021
3404,التحول الى التعليم الالكتروني  عن بعد لمدة 14 يوم URL,Digital Transformation,None,0.585,,,Not clear,No,1.0,Negative,1.0,2020-09-04 18:50:37+00:00,04/09/2020
3405, وبصراحه  تطور رقمي مذهل في دول الخليج  مذهل جداً مع انني ضد هذا التحول الرقمي  ولدي اعتقاد يقيناً ان هذا التحول الرقمي سيؤدي إلى مشاكل ومصائب كبرى في المستقبل ولكن ليس المستقبل القريب. وستعود الدول والشركات والانظمه للاعتماد على الموارد البشريه,Digital Transformation,Favor,0.4247,,F_Explicit,,No,1.0,Neutral,0.6211,2021-03-11 19:07:43+00:00,11/03/2021
3406, لا لفرض تطعيم تجريبي ولا للضغط على الناس من اجله! اللي يبى يطعم الله يوفقه  بطعم في 3 شروط: 1- ضمان ان اللقاح يحمي من كورونا واذا تطعمت اضمن حمايتي لنفسي والآخرين  2- ضمان سلامة اللقاح الآن وبعد أعوام اقلها 5 وأكثرها 10!  3- توقيع تحمل المسؤو,Covid Vaccine,Against,1.0,A_Explicit,,,No,1.0,Negative,1.0,2021-04-21 17:14:33+00:00,21/04/2021
3407,#صباح_السعادة مع تنفس الهواء الطلق والتحدث مع الاصدقاء بلا كمامة بعد الغاء التعليمات بلزوم ارتدائها في الاماكن المفتوحة بعد تطعيم معظم السكان ضد كورونا. يا رب عقبالكم سريعا ,Covid Vaccine,Favor,1.0,,,,No,1.0,Positive,1.0,2021-04-21 19:43:59+00:00,21/04/2021
3408, أسخف حاجة حصلت للحب التحول الإلكتروني ده ..مبقاش حب أصلا,Digital Transformation,None,0.7854,,,Not clear,Yes,1.0,Neutral,0.8197,2020-11-14 16:37:08+00:00,14/11/2020
3409, لان كل ما زاد الاعتماد على الاوراق زادت فرص الواسطات و التنفيع والمصالح  كثير اطراف مو من مصلحتهم التحول الالكتروني الكامل,Digital Transformation,Favor,1.0,,F_Explicit,,No,1.0,Positive,0.6845,2020-07-06 08:07:41+00:00,06/07/2020
3411,   بعد ليش نطعم خلاص لاتجبرون الناس وكل واحد يتحمل،واللي حاشتهم كورونا المفروض ماياخذون تطعيم لان صار عندهم مناعه طبيعية,Covid Vaccine,Against,1.0,A_Explicit,,,No,1.0,Negative,0.6509,2021-04-01 09:38:23+00:00,01/04/2021
3412, تم اخذا القاح الاولي والثانيه الحمدلله لم يحصل ليه اي شي ولا اعراض مع انني خالطت كم شخص مصاب بكورونا بفضل الله ثم اخذا  تطعيم لقاح كورونا لم تنتقل لي العدوى  انصح لمن لم يتطعم اخذا اللقاح في اسرع وقت,Covid Vaccine,Favor,1.0,,F_Explicit,,No,1.0,Positive,1.0,2021-04-24 00:49:04+00:00,24/04/2021
3413," الفرق بعد تشريح الجثة 😂  صاحب شركة لقاح فايزر - لم يأخذه ورفض أخذه  لقاح أسترازينيكا"". تم وقف إستخدامة في سويسرا وهولند وكندا بعد تجلط دماء من اخذوه  هل نحن حقل تجارب كي تقنوعوننا بأخذ مالا نريده  لماذا الأصرار على تطعيم البشر بلقاج صنع جين",Covid Vaccine,Against,1.0,A_Implicit,,,Yes,1.0,Neutral,1.0,2021-03-14 13:19:21+00:00,14/03/2021
3414,العودة إلى مرحلة السيطرة على انتشار الوباء لم تتم إلا بحملات تطعيم لمعظم شرائح المجتمع — اللقاحات (استرازينيكا، وفايز بيونتك) فعالة بشكل كبير   #عمان_تواجه_كورونا  #اللجنة_العليا ,Covid Vaccine,Favor,1.0,,F_Explicit,,No,1.0,Neutral,0.6897,2021-04-24 09:30:22+00:00,24/04/2021
3416," *التحول الالكتروني التام لجميع المعاملات المتعلقة بالعقار "" كهرباء .. ماء .. رهن .. بيع ..شراء ""  *حفظ الصك وسهولة الرجوع له في أي وقت  *تيسير البيع والشراء من أي مكان مثلا "" تستطيع البيع من الرياض لعقار في الشرقية ""  وغيرها من فوائد ولابد ",Digital Transformation,Favor,0.7681,,F_Implicit,,No,1.0,Positive,1.0,2020-07-17 19:27:41+00:00,17/07/2020
3417, التحول الالكتروني في جميع الامور مستقبلاً اضراره اكثر من نفعه على الفرد والمجتمع,Digital Transformation,Against,1.0,A_Explicit,,,No,1.0,Negative,0.724,2020-10-07 21:15:30+00:00,07/10/2020
3418,تبادل الأدلة و المذكرات إلكترونيًا سيساهم في تقصير أمد التقاضي بشكل ملحوظ  السرعة و الجودة أحد أهم سمات العصر القضائي الحديث  والاستعانة بتطبيقات الذكاء الاصطناعي لبناء هذه الأرضية خطوة صحيحة نحو هذا #التحول_التقني.,Digital Transformation,Favor,1.0,,F_Explicit,,No,1.0,Positive,1.0,2020-05-18 19:59:35+00:00,18/05/2020
3422, الاحرار يدعموا #الحرية_الطبية   #لا_للتلقيح_الاجباري  #لا_للتطعيم_الاجباري  #لا_لاغلاق_المساجد  #الحظر_الجزئي  #الكويت_الان  #وعيك_صحتك  #تطعيم_كورونا  #ستعضون_اصابعكم_ندما  ✅✅✅✅✅✅✅✅✅✅✅✅✅✅✅✅✅✅✅✅✅✅✅✅✅✅✅✅✅✅✅✅✅,Covid Vaccine,Against,0.7464,A_Explicit,,,No,0.7625,Neutral,0.508,2021-04-11 20:25:53+00:00,11/04/2021
3423,MENTION تره فعلا مرينا بهالتجربه حاشتنا كورونا والمطعمين ما حسينا بشي بس اللي ما تطعموا حالتهم صارت جداا سيئه واضطروا يدخلون المستشفي وصارت حالتين وفاة عندنا والسبب رفضهم لاخذ تطعيم,Covid Vaccine,Favor,1.0,,F_Explicit,,No,1.0,Neutral,0.3634,2021-07-20 10:21:33+00:00,20/07/2021
3425,📍المراجعة والتدقيق  للشركات العاملة في مجال التجارة الالكترونية.  📍 التطور التقني والتكنولوجي و تصميم النظم  📍اثر الحوكمة على جوده التقارير المالية  📍اثر التحول المحاسبي في القطاع الحكومي في تحقيق الرؤية,Digital Transformation,Favor,1.0,,F_Explicit,,No,1.0,Neutral,0.7198,2022-05-18 18:47:38+00:00,18/05/2022
3426,أظهر التحول الإلكتروني للتعليم فجوة بين المعلمين فقد أظهرت دراسة أن المعلمين الأصغر سناً قابلية أكثر على مواكبة التغير لما يتوفر لهم من خبرة مسبقة على ممارسة هذه الوسائل مقارنة بالمعلمين الأكبر سناً الذين اعتادوا على التعليم وجها لوجه ولَم يتأقلموا مع الوضع الجديد بسرعة وكفاءة...,Digital Transformation,None,1.0,,,Not clear,No,1.0,Neutral,1.0,2020-12-12 19:29:24+00:00,12/12/2020
3427,MENTION الي بالتعليقات ..مسوين فيها اذكياء ومانبي نطعم😅 ذكروني بالعيال الصغار لما يعاندون على شيء مابي مابي😅😂 بفهم يعني شنو بمخوخكم انتوا؟ اذا انتوا ضد تطعيم كورونا ليش تطعمون عيالكم الصغار من الامراض الثانيه؟ ياعالم بليز صحصحوا,Covid Vaccine,Favor,1.0,,F_Explicit,,No,0.693,Neutral,0.693,2021-04-07 07:12:01+00:00,07/04/2021
3428, يعني كانو  ١٢ شخص  ٥ انصابو بالفايرس  ٧ مايتهم كورونا  هذي احصائية زوراتنا وبدون تطعيم والكل تشافا الحمدالله ومحد تعب ودخل عنايه غير يدتي وطلعت الحمدالله واهي بصحه وعافيه,Covid Vaccine,Against,0.6177,A_Implicit,,,No,1.0,Positive,0.3862,2021-04-06 20:40:23+00:00,06/04/2021
3429, يا اخوي انتو تشجعون على اللقاح ولكن معظم  ياخذونه يحسبونه سوبر لقاح وبلا كمام واجتماعات من اول تطعيم، ولا يعرفون ان المناعة لها مدة وفي اي وقت ممكن يصابون ، فممكن توضيح للمتطعمين ان اللقاح هذا يخفف اعراض الاصابة ولا يمنعها حد يفهمهم تراهم بط,Covid Vaccine,Favor,0.6177,,F_Explicit,,No,1.0,Neutral,0.7232,2021-04-07 10:31:35+00:00,07/04/2021
3430, انا اخذت فايزر ثنتين وصابتني كورونا  ماراح اخذ اي تطعيم خلاص,Covid Vaccine,Against,1.0,A_Explicit,,,No,1.0,Negative,0.6128,2021-12-09 19:07:55+00:00,09/12/2021
3432,واحد لا يفقه شيء ينشر خبر الكل يسوي ريتويت للخبر و يطرشون واتس اب يبلشونا ممرض امريكي يحوشه كورونا واهوا ماخذ اللقاح يا حبيبي أمي انت احنا من ننولد ناخذ تطعيمات الجدري مثلاًيحوشنا جدري بس ما يذبحنا ناخذ تطعيم فلو يحوشنا فلو بس مو قوي ولا نموت من الفلو من قالك اللقاح يمنع الإصابه؟,Covid Vaccine,Favor,0.5932,,F_Implicit,,No,0.689,Neutral,0.3923,2020-12-30 19:46:59+00:00,30/12/2020
3433,  بارك الله في جهودك مسؤولة التحول الرقمي بثينه وزادك الله من فضلة إذاعات وتفعيل رائع جدا للتحول الرقمي الله يوفقك ويبارك في عملك🌷,Digital Transformation,Favor,0.7636,,F_Explicit,,No,1.0,Positive,0.7473,2019-10-28 17:29:20+00:00,28/10/2019
3435,#لا_للتطعيم_الاجباري80 تطعيم كورونا مثل التطعيمات الأخرى في شهادة تطعيم كل مواطن . الامر بسيط . من يأخذ اللقاح تقل فرص الإصابة بإذن الله وإذا اصيب فكأنه انفلونزا عادية . والحمدلله على فضله,Covid Vaccine,Favor,0.7467,,F_Explicit,,No,1.0,Neutral,1.0,2021-08-01 09:48:07+00:00,01/08/2021
3436, لأن الواقع الاداري سيء فكيف راح يكون الاونلاين جيد؟! 🤔  الواقع يعكس التحول الإلكتروني,Digital Transformation,Against,1.0,A_Explicit,,,No,1.0,Negative,0.6211,2021-03-06 16:25:22+00:00,06/03/2021
3438,#أمنية٢٠١٩ أتمنى أن عملية #التحول_الرقمي تنفذ بالطريقة السليمة المخطط لها لأنه تعبنا حشو وتكرار رقمي وورقي كنا بواحد وصرنا باثنين نعبي ورق ونعبي الكتروني 😕 وبالنهاية ترسل النسختين واضيع كمان 😂,Digital Transformation,Favor,1.0,,F_Explicit,,No,1.0,Positive,1.0,2019-01-26 20:23:28+00:00,26/01/2019
3439,بسبب #كورونا   الجميع الآن يود ان يلتحق مع الركب نحو التوجه عالميًا الى التحول الرقمي والتطور التكنولوجي من خلال استخدام التكنولوجيا في المعاملات الحكومية  #التعليم_عن_بعد   #التعليم_الإلكتروني   والاجتماعات الالكترونية  الخ.  أن تأتي متأخرا خير من أن لا تأتي!,Digital Transformation,Favor,0.7636,,F_Explicit,,No,1.0,Neutral,0.4007,2020-05-09 13:58:19+00:00,09/05/2020
3440,  التحول التقني للمجتمع أثر سلباً على رعاية بعض كبار السن  وعلى العلاقات الاجتماعية داخل الأسرة  فنجد أفراد الأسرة جميعهم منشغلين عنه وكل فرد من أفراد الأسرة في عالمه الخاص  وفي تواصل مع الآخرين خارج المنزل عبر استخدام الأجهزة الذكية أدى إلى شعور,Digital Transformation,None,0.5852,,,Not clear,Yes,0.7528,Neutral,0.7528,2019-06-24 09:50:22+00:00,24/06/2019
3441,التعليم الالكتروني هو مستقبل التعليم القادم  هناك من يعارض ذلك  وهناك من يرى عدم إمكانية ذلك  وهناك من يعتقد بفشل هذا التحول  ورغم ان هناك بعض التحديات لكن سيكون في المستقبل القريب هو الخيار الأنسب والمفضل  #التعليم_عن_بعد  #التعليم_الإلكتروني  #التعليم,Digital Transformation,Favor,1.0,,F_Explicit,,No,1.0,Negative,1.0,2020-03-09 15:10:56+00:00,09/03/2020
3444, استمرار العمل على التحول الالكتروني وًتنظيمه و ربطه بالجهات يسهل العمليه اكثر للمواطن و للجهات الحكوميه,Digital Transformation,Favor,1.0,,F_Explicit,,No,1.0,Positive,1.0,2021-09-26 15:28:13+00:00,26/09/2021
3447,اثبت التطعيم ضد فيروس كورونا فعالية ممتازة  ما تدخل المطعم الا متطعم او دخول السينما حتى بالسفر بعد سنة ما تسوي اي اجراء حكومي الا عندك شهادة تطعيم هذا تطعيم ضد الفيروس او كفيل الجديد 😂😂😂,Covid Vaccine,Against,0.4222,A_Explicit,,,Yes,1.0,Neutral,0.6259,2021-05-19 00:18:12+00:00,19/05/2021
3450,التحول التقني الذي شهدته المملكة في عهد صاحب السمو الملكي الامير محمد بن سلمان يبهر الشرق والغرب ويدعو للفخر. حيث اصبح بامكان المواطن انجاز معظم اعمله التي كانت تشغل وقته و تقلل من انتاجيته عن طريق هاتفه المحمول.,Digital Transformation,Favor,1.0,,F_Explicit,,No,1.0,Positive,1.0,2021-01-24 15:55:42+00:00,24/01/2021
3453, ترا تطعيم كورونا حاله حال التطعيمات الي خذناها و احنا بزران وشو الي تدخل فيروس و تدمر مناعة ولدك و مدري وش,Covid Vaccine,None,0.7487,,,Not clear,Yes,0.6509,Positive,0.6509,2021-08-29 09:19:05+00:00,29/08/2021
3455,MENTION MENTION بس الحقيقة ان اسرائيل الان خالية تماماً من وباء كورونا وتم تطعيم ٧ مليون مواطن هناك ... فقط للمعلومية,Covid Vaccine,Favor,0.7352,,F_Implicit,,No,1.0,Neutral,1.0,2021-04-30 00:59:57+00:00,30/04/2021
3456,التحول الرقمي لعيادات المشورة الدوائية... مواكبة للتحول الرقمي للرعاية الصيدلية في مستشفيات وزارة الصحة... شكرا جزيلا لفريق العمل المتميز القائم على هذا التحول 🌹 URL,Digital Transformation,Favor,1.0,,F_Explicit,,No,1.0,Neutral,0.5895,2021-06-22 16:52:46+00:00,22/06/2021
3457,    فئة كبييييييرة جتهم كورونا مثل السلام عليكم وراحت ولا حسّو فيها ونسبة الشفاء من كورونا من غير تطعيم ٩٩.٩ فـ لا تعظمون اللقاح أكثر المرض مو خطير على أغلب الناس .,Covid Vaccine,Against,0.5066,A_Implicit,,,No,0.5833,Positive,0.5833,2021-04-17 08:23:34+00:00,17/04/2021
3458, حتى الأجنه لها تطعيم والله اني مدري إلى إذا كان كورونا له 50 سنة موجود ولا 100 على شان يمدي يسوون لقاح حوامل :على الله مقدر المقادير,Covid Vaccine,Against,1.0,,,,Yes,1.0,Negative,1.0,2021-04-25 02:44:25+00:00,25/04/2021
3462,"بانتظار رد إدارات المرور في الدول ""البيروقراطية"" على هذا التحول التقني URL",Digital Transformation,Favor,0.5935,,F_Explicit,,No,1.0,Neutral,0.7345,2022-01-11 17:29:07+00:00,11/01/2022
3463,التحول الالكتروني والتكنولوجيا 📈📈👌,Digital Transformation,None,0.702,,,Not clear,No,1.0,Neutral,1.0,2021-12-14 08:48:27+00:00,14/12/2021
3464,  التحول الرقمي كان ينادي به السلطان قابوس في 2008 مر على مناداته للحكومة بالتحول الرقمي والربط الإلكتروني 13 عام وإلى اليوم التقدم بطء ودون الطموح للآسف,Digital Transformation,Favor,0.5861,,F_Explicit,,No,1.0,Negative,1.0,2021-07-02 07:08:26+00:00,02/07/2021
3465,#لا_للتطعيم_الاجباري105 علي الطواري  الدنمارك تقرر رسميا انهاء جميع قيود كورونا ابتداءا من أول اكتوبر.  اذن .. لا حقن اجبارية  لا كمامات  لا شهادات تطعيم و لا فحص  URL URL,Covid Vaccine,None,0.5899,,,Not clear,No,1.0,Neutral,1.0,2021-08-23 17:59:53+00:00,23/08/2021
3466, خلصنا تطعيم يالشيخ وأخذت السينوفارم لكن سجلت حق جرعة تنشيطية من لقاح فايزر ... وربي يعطينا وإياكم الصحة والعافية,Covid Vaccine,Favor,1.0,,F_Explicit,,No,1.0,Positive,0.6512,2021-05-27 10:20:00+00:00,27/05/2021
3467, مافي الا العافيه..زيه زي اي لقاح و تطعيم يوم كنّا بزران اذا عطونا تطعيمه تسدحنا اسبوع 🤣بس مبطين عن التطعيمات شكلنا نسينا,Covid Vaccine,Favor,1.0,,F_Implicit,,No,1.0,Neutral,1.0,2021-03-13 17:51:47+00:00,13/03/2021
3468,#تكاتف_الشعب_السعودي  ايها الامه،، امة محمد،، متى مارجعتم لله بتوبه خالصه رفع كورونا  بلا عقاقير ولا تطعيم .  ترى التوبه ماتكلف شئ التطعيم يكلف مليارات.,Covid Vaccine,Against,0.5066,A_Implicit,,,No,1.0,Neutral,1.0,2021-04-21 18:45:54+00:00,21/04/2021
3469,تطعيم كورونا البي بيعمل جلطة وبقتل في يومين د بلقاه وين؟,Covid Vaccine,None,0.4154,,,Not clear,No,0.6512,Negative,0.6361,2021-04-09 21:34:04+00:00,09/04/2021
3470, هل سبق وزرتي الهند وخاصه المناطق الفقيرة؟ هذا متوقع لدولة كبيره تعتبر قاره ولا ينتقع الشعب من خيراتها بالاخير هذا احد نتائج التطعيم هو ارتفاع معدل الاصابات حيث انهم قبل فتره اعلنوا عن بدء اكبر حملة تطعيم للعالم وهذه النتيجة كورونا اصابت الاغلبي,Covid Vaccine,Against,1.0,A_Implicit,,,No,1.0,Negative,1.0,2021-04-24 08:35:29+00:00,24/04/2021
3471,تم وضع شريحة جينات الشواذي المعدلة وراثياً. من الحين مشتهية موز. 🍌🐒 #تطعيم_كورونا,Covid Vaccine,None,1.0,,,Not Related,Yes,0.6187,Neutral,1.0,2020-12-29 06:57:48+00:00,29/12/2020
3472,MENTION انا ارفض اي معلم يدرس عيالي من غير تطعيم اذا مطعم وحاشه كورونا بقول هذا قضاء وقدر اما مو مطعم وينقله لعيالنا اهني لا اهو معرض اكثر من الي مطعم للعدوى,Covid Vaccine,Favor,0.7533,,F_Explicit,,No,1.0,Neutral,1.0,2021-09-26 10:09:39+00:00,26/09/2021
3477, التحول الإلكتروني يجب ان يخفض التكاليف لا ان يزيدها,Digital Transformation,Against,0.5974,A_Explicit,,,No,1.0,Negative,1.0,2022-04-15 12:45:20+00:00,15/04/2022
3478,صندوق خليفة يعقد شراكة مع اتصالات ومايكروسوفت لدعم التحول الرقمي للشركات الصغيرة والمتوسطة #في_أبوظبي  في إطار برنامج التمكين الإلكتروني الذي أطلقه الصندوق URL,Digital Transformation,Favor,0.7479,,F_Explicit,,No,1.0,Positive,1.0,2021-04-21 12:18:53+00:00,21/04/2021
3479,بم أنه كله هيتحول  رقمي في فكره عبقريه أننا نخلي كل حاجه في شريحه qr code مثلا ملزوقه علي قفا المواطن بحيث أنه ياخد المرتب يتلسع علي قفاه يدفع قسط علي قفاه يدفع اجره التباع ياكله علي قفاه كده يبقي سهلنا التحول الرقمي,Digital Transformation,None,0.585,,,Not clear,No,1.0,Negative,0.5999,2020-09-21 06:56:45+00:00,21/09/2020
3480,تلقيت اليوم الجرعة الأولى من #تطعيم_كورونا . تنظيم رائع وسلس .  شكرا لقيادتنا العظيمة   وشكرا لوزارة الصحة  . ,Covid Vaccine,Favor,1.0,,F_Explicit,,No,1.0,Positive,1.0,2021-01-08 19:24:29+00:00,08/01/2021
3484, نركز على تطعيم الناس بدل الاغلاق وغيره لان قبل كذا صار اغلاق ولا تغير شي وثاني شي دام عندنا لقاح متوفر ليش ما نشدد في تطعيم الناس و اذا كانت الفئه المستهدفه ما تتجاوب نجاوزها و نبداء بتلقيح الجميع بكذا نتخلص من هذي القرارات الي غير مدروسه,Covid Vaccine,Favor,1.0,,F_Explicit,,No,1.0,Neutral,0.6838,2021-03-26 04:30:55+00:00,26/03/2021
3485,لله الحمد والمنه تم الانتهاء من تطعيم ( كوفيد ١٩ ) لقاح فايزر  ب #الدمام #الصالة_الخضراء ,Covid Vaccine,Favor,1.0,,F_Explicit,,No,1.0,Positive,1.0,2021-04-19 06:30:58+00:00,19/04/2021
3486,  التحول التقني أصبح مطلبا ضروريا في هذا العصر,Digital Transformation,Favor,1.0,,F_Explicit,,No,1.0,Positive,0.7454,2020-10-15 10:33:57+00:00,15/10/2020
3487,أرى أن #التحول_الرقمي هو أحد أهم الركائز الأساسية لتحقيق #رؤية_2030 وباتت ايجابياته جليةً جداً في الخمس سنوات الأولى من انطلاق الرؤية وحتى قبيل ظهور وباء#COVID19   ولا شك ان للتحول الرقمية انعكاساً مباشراً على #جودة_الحياة والمشاركة المجتمعية وتجاوز عقبات المكان والزمان URL,Digital Transformation,Favor,0.5912,,F_Explicit,,No,1.0,Neutral,0.7369,2021-07-05 15:37:35+00:00,05/07/2021
3488,  التحول الرقمي لن يكلفهم  بل سيدخل عليهم الكثير من الإيرادات في المنافذ والمؤانئ والسفارات  الدفع الإلكتروني برقم حساب للحكومة مربوط ب الخدمه هوا افضل الحلول لحلحله الفساد المستشري في مؤسسات الدولة وموظفيهاا   نحن في القرن ,Digital Transformation,Favor,0.7503,,F_Explicit,,No,1.0,Neutral,1.0,2020-06-09 01:47:18+00:00,09/06/2020
3490,MENTION تطعيم الاطفال اخذ سنوات حتى تم إنتاجه و سنوات تجريبيه وبعدها تك أعتماده ولم يظهر عليه اثار سلبيه والشركه تتحمل المسؤوليه ؟ اما لقاح كورونا تم انتاجه خلال اشهر وتم اعطاءه للبشريه فوراً و دون تحمل مسؤوليه و له اثار جانبيه هذا يمسى عبث بأرواح الناس,Covid Vaccine,Against,1.0,A_Explicit,,,No,1.0,Negative,0.6094,2021-07-12 00:27:21+00:00,12/07/2021
3491,#لا_للتطعيم_الاجباري205 تطعيم مايمنع كورونا وش فائدته .. انا ابغى اتكورن وماابغى اخذ اللقاح,Covid Vaccine,Against,1.0,A_Explicit,,,Yes,0.6509,Negative,0.6509,2021-12-03 17:19:06+00:00,03/12/2021
3492, للأسف ومن واقع فإن التحول الإلكتروني أثبت فشله لدى بعض الجهات وذلك نظرا لعدم وجود سقف زمني للانجاز.  سابقا كان عامل المراجعة احد وسائل الضغط لانهاء معاناة التاخير  الآن أغلقت الابواب وأصبح عذر كورونا سببا لفرض التحول الإلكتروني الذي لم يق,Digital Transformation,Against,0.4047,A_Explicit,,,No,1.0,Neutral,0.6211,2021-02-14 18:57:43+00:00,14/02/2021
3493, تطعيم صار إجباري بأغلب الدول خلاص دعاية أنه اختياري بس بتلفزيون لكن واقع شي ثاني ماكو سفر ولا شغل ولا دوام ولاسينما إذا كنت مو طاق إبرة تطعيم تدري ناس خذو تطعيم مرتين وصار فيهم كورونا وناس خذو بعمر كبير ما تحملو وماتو إلى الآن لقاحات غير آم,Covid Vaccine,Against,1.0,A_Explicit,,,No,1.0,Neutral,0.6981,2021-03-30 23:16:51+00:00,30/03/2021
3494, اوك فهمت 🦦 اول مره اعرف لقاح يطلقون عليه اسم تطعيم 😅,Covid Vaccine,None,1.0,,,Not clear,Yes,0.684,Neutral,1.0,2021-09-27 20:57:15+00:00,27/09/2021
