ID,text,target,stance,stance:confidence,against_reason,favor_reason,none_reason,sarcasm,sarcasm:confidence,sentiment,sentiment:confidence,datetime,Date
1225,منظمة الصحة العالمية: الجرعة التنشيطية الثالثة من لقاحات كورونا وسيلة لحماية الأكثر عرضة للخطر من المرض و”ليست رفاهية”,Covid Vaccine,Favor,0.5954,,F_Implicit,,No,1.0,Neutral,0.708,2021-08-30 11:25:06+00:00,30/08/2021
1226, خل كورونا #تمر عليها الفيروسات #تتشهد قال تطعيم قال . 😅,Covid Vaccine,Against,0.7573,A_Explicit,,,Yes,0.7812,Negative,0.7588,2022-05-11 06:14:02+00:00,11/05/2022
1229,كورونا كانت حتبقي اسهل من تطعيم كرونا #AstraZeneca,Covid Vaccine,Against,0.59,A_Explicit,,,No,0.7869,Negative,0.501,2021-09-29 14:14:26+00:00,29/09/2021
1231,اصراركم العجيب و المريب في تطعيم أطفال لم تأثر بهم كورونا و لم يتوفى طفل منه او حتى يدخل العناية المركزة شيء ينافي العقل و المنطق!! لا يحتاجون الى كمامات و لا يحتاجون تباعدكم! الحمد لله منذُ بداية الجائحة و لمدة سنتان اختلطوا و لم نرى اصابات او نقل عدوى #لا_للتطعيم_الاجباري173,Covid Vaccine,Against,1.0,A_Explicit,,,No,1.0,Neutral,0.6311,2021-11-01 05:01:16+00:00,01/11/2021
1232,MENTION MENTION لماذا في عز جائحة كورونا لم نسمع بالتهاب عضلة القلب الا بعد ما تم تطعيم الناس؟!الكل يعرف و حتى وزارة الصحة صرحت ان كورونا ليس خطيرة ع الاطفال   ليس مبرر ان اطعم جميع الاطفال بمرض ليس خطير عليهم و اعرضهم لاعراض جانبية ممكن تؤدي الى وفاتهم و الملام في النهاية من اخذهم بيده للتطعيم,Covid Vaccine,Against,1.0,A_Explicit,,,No,1.0,Neutral,0.5578,2021-11-12 00:21:29+00:00,12/11/2021
1233,يلا كلكم يا عيال اتطعموا لقينا فائدة من تطعيم كورونا URL,Covid Vaccine,Favor,1.0,,F_Explicit,,No,0.6311,Neutral,0.6311,2021-12-09 13:27:17+00:00,09/12/2021
1236,اتممت اخذ الجرعه الاولى من تطعيم كورونا صباح اول ايام الشهر الفضيل. ولله الحمد. التجربه في حد ذاتها مبهره في كل تفاصيلها. الله يعزك يا بلادي #السعوديه  و شكرًا لكل فرد في #وزارة_الصحة URL,Covid Vaccine,Favor,1.0,,F_Explicit,,No,1.0,Positive,1.0,2021-04-13 05:11:22+00:00,13/04/2021
1237, للأسف موضوع التحول الإلكتروني إن لم يجد اهتمام شخصي من مجلس الوزراء والضغط على الجهات الحكومية لتتحول بشكل صحيح ويتم محاسبة المقصرين ما راح يكون هناك تحول حقيقي,Digital Transformation,None,0.604,,,Not clear,No,0.7742,Neutral,0.7742,2021-03-01 11:46:17+00:00,01/03/2021
1246, نريد خدمة إدخال قراءة العدادات بديل مراجعة الفروع.. التحول الالكتروني كامل مطلب,Digital Transformation,Favor,1.0,,F_Explicit,,No,1.0,Positive,0.7741,2021-06-24 16:06:34+00:00,24/06/2021
1247,   قصدك هذا التطعيم ؟؟  ترى مافي شي اسمه تطعمي وخلاص تقدري تستفسري من ادارة المدرسة اذا هالكلام صدق وانا معلمة واقولك مافي تطعيم اجباري او تطعيم كورونا بالمدارس URL,Covid Vaccine,None,0.5763,,,Not clear,No,1.0,Neutral,1.0,2022-04-07 16:51:47+00:00,07/04/2022
1248,"هل عملك جاهز للتحول الرقمي القادم؟   ""يُقاس النجاح في التحول الرقمي بالقيمة التي يتم إنشاؤها عندما يعمل الأشخاص باستخدام الأدوات التقنية"".  URL",Digital Transformation,None,0.4084,,,Not clear,No,1.0,Negative,1.0,2021-07-23 11:00:39+00:00,23/07/2021
1249,اللي يعرف بالله عليكم توا حد شاف النسخة الإلكترونية بتاع تطعيم كورونا في منظومة مكافحة الأمراض لقا غلط في اسمه بالإنجليزي و تاريخ الميلاد كيف يقدر يصلحه ولا شن الحل لأن مسافر بره وتفاصيل هذينا يركزوا فيهن ولا شن يصير,Covid Vaccine,None,0.6118,,,Not clear,No,1.0,Neutral,1.0,2022-05-14 20:47:23+00:00,14/05/2022
1250,الله ياخذ تطعيم كورونا الي من بعده ما شفت خير,Covid Vaccine,Against,1.0,A_Explicit,,,No,1.0,Negative,0.6128,2021-09-21 17:13:28+00:00,21/09/2021
1252,التحول الالكتروني - بشكل عام- (لانه في ناس تتحسس و تستعنى ع طول)   يصيح في زاوية و الله ☺️🙏🏻 و الشغل الي كنا نسويه مره وحده صرنا نسويه مرتين لكن الحمدلله على التطور 👍🏼 URL,Digital Transformation,Favor,0.5912,,F_Explicit,,No,0.7956,Negative,0.4137,2021-07-06 06:54:30+00:00,06/07/2021
1255, وزارة العدل مشكوره من الوزارات التي ابدعت في التحوّل الالكتروني  ادخل موقع ناجز واتبع الخطوات بكل يسر وسهوله,Digital Transformation,Favor,1.0,,F_Explicit,,No,1.0,Positive,0.631,2021-09-12 18:25:18+00:00,12/09/2021
1256,اللهم لك الحمد والشكر 🤲 اللهم ارفع عنا الوباء والبلاء وسيء الأسقام  حفظك الله يابلادي ودام عزك #حكومة و #شعباً 🇸🇦🕋🤲 حصلت بحمد الله على الجرعة الأولى من تطعيم #لقاح_كوفيد_19 #لقاح_كورونا بمركز الرعاية الصحية الأولية بالبحيرات #مكة_المكرمة  #صحتي ,Covid Vaccine,Favor,1.0,,F_Explicit,,No,1.0,Positive,1.0,2021-02-28 14:49:41+00:00,28/02/2021
1257, عشان الماتش ماتلعبش الشرطة دخلت قبضت على لاعيبة البرازيل عشان زوروا شهادة تطعيم كورونا والماتش ماتلعبش! لو كان الشناوي مسك رجلة واستموت لما اتحدفت عليه ازازة ومشينا كان ممكن يتعاد!,Covid Vaccine,None,1.0,,,Not clear,No,1.0,Neutral,1.0,2022-05-09 15:25:09+00:00,09/05/2022
1261,يتوجب علينا الاستفادة والبناء على تجاربنا التي نجحت والتي لم تنجح على حدٍ سواء حتى نستطيع المضي قدماً باتجاه اقتصاد رقمي حقيقي   #كورونا #جمعية_انتاج #التحول_الرقمي #COVID19 #DigitalTransformation #STS  URL,Digital Transformation,Favor,0.5895,,F_Explicit,,No,1.0,Neutral,1.0,2020-05-24 19:20:03+00:00,24/05/2020
1263,  قواكم الله ..  ونتمنى من جمعيات مناطق الكويت جميعها ان تأخذ حذوكم بأسرع وقت لتتمكن من تطعيم اللقاح لموظفينها وتكون الجمعيات بأمان ..  ونتمنى السلامه للجميع .. 🌹🌷🌹  #الحظر_الجزئي #كورونا,Covid Vaccine,Favor,1.0,,F_Explicit,,No,1.0,Positive,1.0,2021-04-16 18:58:49+00:00,16/04/2021
1264,#التحول_التقني مطلب مهم جدا في تمثيل الحكومة الرقمية وتتصدر #السعودية_العظمى في بنيتها التحتية فخورين بالانجاز والى الامام يا أجمل وطن. URL,Digital Transformation,Favor,1.0,,F_Explicit,,No,1.0,Positive,1.0,2021-09-04 22:21:11+00:00,04/09/2021
1266,اغلاق الانشطه الصيفيه للاطفال والحضانات هو سلسله من تخبطات لجنه كورونا الدايخه واهيا  رساله مبطنه الى اولياء الامور لتطعيم اولادهم خافوا الله بالارواح وكافي الاصابات اللي قاعد تتزايد مع تزايد تطعيمكم  #لا_للتطعيم_الاجباري60 #الكويت #تطعيم_كورونا ,Covid Vaccine,Against,1.0,A_Explicit,,,No,1.0,Neutral,0.508,2021-07-13 06:59:57+00:00,13/07/2021
1269,MENTION MENTION فيها ناس تطعموا مرتين وجتهم كورونا ما منع التطعيم بشيء نسبة الي ماتوا من كورونا ما يتجاوز ٢ % ومشكوك في الرقم واغلب الي ماتوا من امراض مزمنه او كبر في السن واجبار الناس على تطعيم غير انه تجريبي ولم يثبت فعاليته ؟؟؟؟,Covid Vaccine,Against,1.0,A_Explicit,,,No,1.0,Negative,0.6366,2021-08-01 09:10:15+00:00,01/08/2021
1270, شكرا من أعماق القلب لمجلس الشؤون الإداريه للقضاء لهذا التحول الالكتروني,Digital Transformation,Favor,1.0,,F_Explicit,,No,1.0,Positive,1.0,2020-03-03 18:31:11+00:00,03/03/2020
1271,التحول الرقمي هو انك تحولي فلوس علي رقمي URL,Digital Transformation,None,1.0,,,Not clear,No,1.0,Neutral,0.7515,2021-01-31 06:34:25+00:00,31/01/2021
1272,محكمة افتراضية URL عبر    يمثّل التحول التقني والرقمي المذهل للمملكة ملمحاً حضارياً يدفع بنا إلى مصاف الدول الكبرى  بل نستطيع الجزم بأننا فُقناها تقنياً,Digital Transformation,Favor,0.5937,,F_Explicit,,No,1.0,Positive,0.6006,2022-03-29 02:32:28+00:00,29/03/2022
1273,  التحول الرقمي .. هني القمندة .. مو كلشي رقمي زين يا عيال .. احيانا الامان كله بالاحتفاظ بالقديم 😉,Digital Transformation,Against,0.6093,A_Explicit,,,No,1.0,Negative,1.0,2021-10-30 14:56:52+00:00,30/10/2021
1278,  التحول الرقمي هو الحل الصحيح  وأن تبدأ هذه الأعمال الصغيرة في مواكبة التطور التقني.  قبل ١٠ سنوات كان إنشاء موقع إلكتروني يعد من الكماليات.   الان الموقع الإلكتروني  أصبح من الضروريات  ومن الطبيعي أن تموت الشركات الصغيرة إن ل,Digital Transformation,Favor,1.0,,F_Explicit,,No,1.0,Positive,1.0,2020-04-08 21:09:57+00:00,08/04/2020
1282, عشان كده واحد من اهم المشاريع اللي بتمني الاسراع ف تنفيذها التحول الرقمي والربط التقني وابعاد المواطن ع التعامل المباشر مع الموظف .. دي المشاريع اللي هيستفاد منها الـ 100 مليون,Digital Transformation,Favor,1.0,,F_Explicit,,No,1.0,Positive,0.616,2022-03-19 12:47:46+00:00,19/03/2022
1284, سوال   الي طاف موعد تطعيم الجرعه الثانيه كورونا  شنو الحل … !!؟؟؟   حاولت اسجل من الموقع يقول انت مسجل !!!,Covid Vaccine,None,0.7533,,,Not clear,No,1.0,Neutral,1.0,2022-05-14 04:46:09+00:00,14/05/2022
1285,(فخر اني سعودية) اصبحت هوية بحد ذاتها .. كلمة الشكر والثناء لاتكفي وشعور الامان في بلدي نعمة عظيمة .. شكرا لابطال الصحة على الجهود الجبارة والنفسية الحلوة والابتسامة اللطيفة في كل ممر من ممرات تطعيم لقاح كورونا   ,Covid Vaccine,Favor,1.0,,,,No,1.0,Positive,1.0,2021-03-12 15:18:41+00:00,12/03/2021
1287,جُعلت التقنية لتسهيل المعاملات والأعمال ✨   شكراً شركة التحول التقني على النفع الذي تقدمون   #المرأة_التقنية URL,Digital Transformation,Favor,1.0,,F_Explicit,,No,1.0,Positive,0.7563,2019-03-19 18:44:17+00:00,19/03/2019
1288,"  التحول الرقمي يشعرك بالفخر و إعتزاز القادم أفضل بحول الله القادم ""رقمي""",Digital Transformation,Favor,0.4141,,F_Explicit,,No,1.0,Positive,1.0,2019-04-21 22:24:47+00:00,21/04/2019
1289,MENTION MENTION من اول يوم لطفلك في هذي الحياة حتى صار عمره سنتين او ثلاث هو ياخذ تطعيمات لأنواع عده من الأمراض. والحين بترفض تطعيم كورونا!!!!,Covid Vaccine,Favor,1.0,,F_Explicit,,No,0.7289,Neutral,0.7289,2021-07-03 18:46:48+00:00,03/07/2021
1290,MENTION MENTION طيب انا جاني مرض كورونا بدون اعراض وكان خفيف جدا  يعني قد جتني زكمة اقوى منه.  واتعافبت منه وصار عندي مناعة  ليش أجبر على اخذ اللقاح؟ وانا ما اعمري اخذت تطعيم انفلونزا او بنادول في حياتي,Covid Vaccine,Against,1.0,A_Explicit,,,No,1.0,Neutral,1.0,2021-05-08 10:23:40+00:00,08/05/2021
1291, ترا بالنهايه يوم دخلت المطار حقهم محد طلبه مني ابددااا ولا احد جاب طاري بس كان معي تحليل كورونا ورقة تطعيم بس بالاخير وريتهم التطعيم بس ومشوني,Covid Vaccine,None,0.7312,,,Not clear,No,1.0,Neutral,1.0,2022-05-10 11:26:22+00:00,10/05/2022
1293,  توجد ضبابية في موضوع لقاح كورونا   ألا وهي :  تطعيم الفايزر كاتوا يقولون بالبداية بأن المدة بين الجرعتين 21 يوم  وبعد ما انقطع اللقاح عالميا قالوا لا يضر حتى 6 أسابيع   والآن تم تأجيل الجرعة الثانية لأبعد من 6 أسابيع!!   ما أراه هو تخمين وليست دراسة ؟!,Covid Vaccine,Against,1.0,A_Explicit,,,No,1.0,Neutral,0.708,2021-04-17 09:22:41+00:00,17/04/2021
1295,#لا_للتطعيم_الاجباري77 اخو صديق الوالد دكتور وقال لنا اللقاح خطير جدا لا تاخذوه وقال انه هو والطاقم الطبي ما اخذوه فقط الاعلام يكذب يعطونهم فيتامينات ويقولو هذا تطعيم كورونا وقال احنا الاطباء ما اخذناه ولن نأخذه. URL,Covid Vaccine,Against,1.0,A_Explicit,,,No,1.0,Negative,0.6827,2021-07-28 15:24:18+00:00,28/07/2021
1296,توكلنا .. حل رقمي لمجتمع آمن   بفضل الخدمات التي قدمها هذا التطبيق  تمكن المجتمع من تجاوز أزمة كورونا بسلام  ويساهم بشكل فاعل في التحول الرقمي.  توكلنا استحق #جائزة_غازي_القصيبي  URL,Digital Transformation,Favor,1.0,,F_Explicit,,No,1.0,Positive,0.9157,2022-04-19 18:24:59+00:00,19/04/2022
1297, شهادت تطعيم كورونا.     اغلى,Covid Vaccine,None,0.5567,,,Not clear,No,0.8395,Neutral,0.6895,2022-04-21 17:18:58+00:00,21/04/2022
1299, وهل تمت دراسة آثار تطعيم كورونا كما تمت دراسة آثار تطعيم الحصبة!!! بل بالعكس  تطعيم الحصبة يساعد على عدم اصابتك بالمرض بمشيئة الله لكن تطعيمة الكورونا لا تمنع.   شخصيا انا محصن لكن لا انتقد من يمنع نفسه واهله من اخذها.,Covid Vaccine,Against,0.7594,A_Explicit,,,No,1.0,Negative,0.6343,2022-04-07 19:04:44+00:00,07/04/2022
1301, الشعب فرض رايه 👏🏼👏🏼  No mask No lockdown  No vaccine   كانوا ضد التطعيم الإجباري و ضد تطعيم الأطفال وطالبوا بالحرية و إنهاء مسرحية كورونا..,Covid Vaccine,Against,0.59,A_Explicit,,,No,1.0,Neutral,0.7118,2021-07-05 20:30:52+00:00,05/07/2021
1302,MENTION الله يهديهم اذا التطعيم مؤامره كيف تطعمون عيالكم من الحصبه والدرن و و و  بس تطعيم كورونا مؤامره والتطعيمات الثانيه لا؟! نظرية المؤامره بكل شي دمار للعقل والمنطق   شغل عقلك قليلا بدون توجيه وستجد انك كنت بعالم منعزل بفعلك,Covid Vaccine,Favor,1.0,,F_Implicit,,No,0.7571,Neutral,0.7571,2021-11-07 04:45:22+00:00,07/11/2021
1303,لو افترضنا ان فيه تحول رقمى فى مصر رغم انى متأكد انه كله جحشنة فى جحشنة وحاجة ملهاش أى علاقة بالتطوير ونظم تكنولوجيا المعلومات  لازم نفهم ان سلامة الناس و حياتهم مش أولوية فى التحول الرقمى  الأولوية للسبوبة و أى حاجة بتجيب فلوس للعصابة اللى بتحكم URL,Digital Transformation,Against,0.5888,A_Explicit,,,No,1.0,Negative,0.7546,2020-12-15 09:04:27+00:00,15/12/2020
1305,الشيء الذي يدعو للحيرة  لماذا على الدول الأفريقية أخذ تطعيم كورونا  في حين أن كل الدول الأفريقية نسبة الإصابة فيها طفيفة ولا تكاد تكون مؤثرة  لقد منحنا الله القوة والمناعة ضد هذا المرض,Covid Vaccine,Against,1.0,A_Implicit,,,No,1.0,Neutral,0.6901,2021-01-17 10:38:02+00:00,17/01/2021
1309, المطر خل يولي ما يدري وين الله قاطه من عقب اقتراحه بشرط تطعيم الطلبة لعودة المدارس ب لقاح تجريبي واختياري فاحت بلاويه بالعالم ما سوتها ولا دولة .. هذا داعم للتاجر وكيل اللقاح! ومواقفه بتفضحه اكثر خسارة فيه الصوت !,Covid Vaccine,Against,1.0,,,,No,1.0,Negative,1.0,2021-04-20 11:47:16+00:00,20/04/2021
1310,  الجلطات الدماغية من المضاعفات المذكورة على نشرة اللقاح   كل شي بقدر الله حتى اللي يموت من كورونا بدون تطعيم لو طعم هم راح يموت من كورونا بقدر الله ان كان مقدر عليه   ندري ان كل شي مكتوب ومن باب أولى الثقة بالله 🌹مو بتطعيم ( يضر ,Covid Vaccine,Against,0.7405,A_Explicit,,,No,1.0,Neutral,0.689,2021-09-29 21:28:39+00:00,29/09/2021
1311,  كلش ما ساعدوني المطعمين بشي - بالعكس عتونا وخلوا أمد الأزمة يطول ولا الحالات بفضل الله بنزول من ١٢/٢٠٢٠ وبدون تطعيم قبل لا يوصل    يوم حاشتني كورونا كانت من مطعمين بكل أسف اهم حاشتهم قوية واحنا ولا شي يذكر ولا حسينا بشي😄👍🏻  و,Covid Vaccine,Against,0.6058,A_Explicit,,,No,1.0,Negative,0.7699,2022-04-28 01:32:15+00:00,28/04/2022
1312,. . في كلوب هاوس .. كثير من الغرف التي تطرح موضوع تطعيم كورونا وأن التلقيح مؤامرة عالمية لتغيير  الجينات على أساس إن جينات من يروجون لهذا الأمر ..  متفوقه على جينات ( إينشتاين )  . . أعقل يازعبله 🙄,Covid Vaccine,Favor,1.0,,,,Yes,0.5455,Neutral,1.0,2021-04-03 07:23:01+00:00,03/04/2021
1313,هذا الدراسه العالميه الحديثه التي تعاون و شارك فيها (قسم الجراحه) استنتجت ان حالات الوفاة بعد العمليات الجراحيه اقل في المرضى الذين تم اخذهم #تطعيم_كورونا. ,Covid Vaccine,Favor,0.7533,,F_Implicit,,No,1.0,Neutral,0.7029,2021-03-26 20:03:47+00:00,26/03/2021
1314,"سرنا الإعلان عن فوز نور تكافل بجائزة ""أفضل مشروع تحول رقمي للعام"" مساء الاثنين الموافق  27 سبتمبر 2021!   #نور_تكافل #جائزة #التحول_الرقمي",Digital Transformation,Favor,0.7547,,F_Explicit,,No,1.0,Positive,1.0,2021-09-29 08:34:19+00:00,29/09/2021
1315,*شغوفين للتحول الإلكتروني*  تم انجاز اليوم تحويل جميع عمليات الدفع والاستلام لفرق خدمات الابار تحت مجموعة معاينة الابار بشركة نفط الكويت ياتي هذا الانجاز تماشيا مع التوجه العام لانجاز المعاملات رقميا  شكرا لجميع الفرق العامله لهذا الانجاز #التحول_الرقمي URL,Digital Transformation,Favor,1.0,,F_Explicit,,No,1.0,Positive,1.0,2020-07-29 22:52:41+00:00,29/07/2020
1316,ما تشهده #المملكة_العربية_السعودية  من تحول رقمي كبير  في تطبيق التكنولوجيا الرقميه في جميع الجوانب الاجتماعية  أبشر . توكلنا   تباعد   …. وهذا التحول الرقمي الوطني أحد الركائز الاساسية لرؤية 2030   ..    حُق لنا أن نفخر 💜 URL,Digital Transformation,Favor,1.0,,F_Explicit,,No,1.0,Positive,1.0,2021-11-06 17:19:14+00:00,06/11/2021
1317,البريد الالكتروني سنة ١٩٨٤  والله نحن نعيش الجيل الذهبي للتحول الرقمي ولكن قليل من يدرك الشي هذا   صحيح الغرب سابقنا ١٩٨٤ ولكن نحن نلحق بهم و نحقق انجازات تتفوق على بعض مالديهم ابسط مثال التحول الرقمي الذي نقلنا الى مصاف العالم الاول URL,Digital Transformation,Favor,1.0,,F_Explicit,,No,1.0,Positive,0.6753,2021-11-08 16:53:31+00:00,08/11/2021
1319,"النقلات الكبيرة الي كل يوم نشوفها في شاهد نت و التطور التقني و الاداري ما جاء من فراغ  ام بي سي من بدايتها في التسعينات كانت سابقة عصرها و شاهد نت امتداد لهذا السبق  في المستقبل القريب و مع التحول الرقمي المنصة راح تتسيد الاعلام الحديث ""عربيا""وربما مستقبلاً تنافس نتفلكس ""عالمياً""",Digital Transformation,Favor,1.0,,F_Explicit,,No,1.0,Positive,1.0,2021-05-13 20:07:38+00:00,13/05/2021
1320, ليش عاد فيه احد يتطعم من كوفيد-19.. خلاص العالم وقف تطعيم. و الدول فتحت حدودها و لم تعد تطلب حتى شهادة تلقيح او فحص كورونا..,Covid Vaccine,Against,0.4123,A_Explicit,,,No,1.0,Neutral,0.7663,2022-05-14 02:34:48+00:00,14/05/2022
1321,  في الأزمات تخلق الفرص  ولعل الظروف الحالية تكون فرصة لكثير من القطاعات الحكومية خاصة لتفعيل التحول الالكتروني في تعاملاتها بشكل رسمي.,Digital Transformation,Favor,1.0,,F_Explicit,,No,1.0,Positive,1.0,2020-03-15 06:25:21+00:00,15/03/2020
1322,نشكر ونثمن لوحدة التحول الرقمي التابعة للجنة الوطنية للتحول الرقمي ✨ انضمامها كشريك استراتيجي لمؤتمر الصحة في العصر الرقمي .. فأنتم خبراء الوطن في هذا المجال ومعكم تتحقق الأهداف الصحية الرقمية لرؤية 2030.   #لنهلم_الصحة URL,Digital Transformation,Favor,1.0,,F_Explicit,,No,1.0,Positive,0.5873,2019-03-09 16:15:51+00:00,09/03/2019
1323,التحول من الدفع النقدي الي الدفع الإلكتروني من اهداف #رؤية_السعودية_2030 وتساعد على منع أو تعقب عمليات #الاحتيال بما فيها غسيل الأموال و #التستر_التجاري URL,Digital Transformation,Favor,1.0,,F_Explicit,,No,1.0,Positive,0.7258,2020-08-20 12:15:59+00:00,20/08/2020
1324,مشكلة التحول الرقمي في الاردن هي عدم وجود جهة مركزية تخطط لعمليات تبادل البيانات بين الجهات المختلفة لتسهيل عملية اعادة هندسة كافة العمليات والاجراءات الحكومية لتحول رقمي فعال  اللي بيصير حاليا هو تغيير في طريقة تقديم الخدمة من خلال نفس الروتين الحكومي العقيم.,Digital Transformation,Against,0.7547,A_Explicit,,,No,1.0,Negative,1.0,2021-09-09 11:11:52+00:00,09/09/2021
1325,رسمياً وكأول دولة في العالم المملكة العربية #السعودية تدشن #الجواز_السعودي_الإلكتروني   المملكة في تسارع نحو التحول الرقمي  لا يكاد يمر علينا شهر إلا هناك إضافة رقمية جديدة .. رحلة التحول بدأت .. لتستمر ويستمر التحول نحو تحقيق رؤية المملكة 2030 URL,Digital Transformation,Favor,1.0,,F_Explicit,,No,1.0,Negative,0.7345,2022-02-10 21:17:26+00:00,10/02/2022
1327,معالي الوزير حفظه الله     نظراً للظرف الحاصل #كرونا أليست فرصة مناسبة لـ #مبادرة تجربة وتفعيل #التعليم_الإلكتروني عن بعد لتطويره وتحسينه بين المعلم وطلابه ( حتى وإن كان غير إلزامي ) لاسيما وأن #التحول_الرقمي هو هدف أساسي لـ #رؤية_السعودية_2030 #وزارة_التعليم,Digital Transformation,Favor,1.0,,F_Explicit,,No,1.0,Positive,0.5748,2020-03-05 17:18:23+00:00,05/03/2020
