ID,text,target,stance,stance:confidence,against_reason,favor_reason,none_reason,sarcasm,sarcasm:confidence,sentiment,sentiment:confidence,datetime,Date
2326, قدمت اعتراض على التخمين لامانة عمان فطلبوا مني تقديمه الكترونيا  وفعلت ذلك  ولكن ومنذ سنة ونصف وحتى هذه اللحظة لم يصلني الرد  وكلمها اتصلت بهم هاتفيا للاستفسار لا احد يرد. وانت تتحدث عن التحول الالكتروني؛ ونحن بعيدين كل البعد حتى عن مفهومه.. ,Digital Transformation,Against,0.6024,A_Explicit,,,No,1.0,Negative,0.7546,2021-06-30 23:35:19+00:00,30/06/2021
2327, المشكله ليست في جيل التسعين إنما في التحول التقني والاعلامي الذي حصل في هذه الفتره وصنع فجوة معرفيه جعل أبناء التسعين يضيع بين توجيهات جيل الثمانين وما قبلهم والتطور الواقع امامهم مما تسبب في فقدان الهوية والشخصيه,Digital Transformation,Against,1.0,A_Explicit,,,Yes,0.5805,Negative,0.4181,2018-06-11 20:45:59+00:00,11/06/2018
2330,#لا_للتطعيم_الاجباري59 #لا_للتطعيم_الاجباري60 الكثرة لم تكن في يوم من الأيام مقياس للصح والخطأ. وفي القرآن الكريم الكثير من الشواهد على ذلك. لو تم تطعيم ٧ مليار إنسان بسموم كورونا  فلن أكون واحد منهم بإذن الله. URL,Covid Vaccine,Against,1.0,A_Explicit,,,No,1.0,Negative,0.6827,2021-07-11 13:05:40+00:00,11/07/2021
2334,مرينا بتجربة جميله في تعليم طلابنا #عن_بعد أعتقد بإستطاعتنا التحول الى التعليم الالكتروني والفصول الافتراضيه حتى في التخصصات العلمية التي تحتاج الى تطبيق أو الى معامل  يحضر الطالب (ـه) فقط الجامعه للمعمل والاختبارات ...#جامعة_طيبة #وزارة_التعليم,Digital Transformation,Favor,1.0,,F_Explicit,,No,1.0,Positive,1.0,2020-07-15 20:49:48+00:00,15/07/2020
2336,الحمد لله يارب تم تطعيم الوالد والوالده والاخوان بلقاح كورونا اليوم العائله المحصنه 😎,Covid Vaccine,Favor,1.0,,F_Explicit,,No,1.0,Positive,1.0,2021-04-17 22:56:50+00:00,17/04/2021
2337,MENTION MENTION MENTION تطعيم الاطفال له دور في وقاية المجتمع بكامله بالاضافة لحماية الاطفال.. وبما انه ثبت عدم ضرره على الاطفال لذلك الافضل تطعيمهم لحصر النسخ المتحورة شديدة الضرر قدر الامكان الى ان نصل للنسخ الدائمة قليلة الضرر عندها سيكون تطعيم كورونا كالانفلونزا سنويا ويتم تحديثه تركيبته دورياً,Covid Vaccine,Favor,0.7472,,F_Explicit,,No,1.0,Neutral,0.5841,2021-11-13 12:21:24+00:00,13/11/2021
2338,اكبر نسبة تطعيم ضد كورونا لعدد السكان كانت في اسرائيل.  واليوم تسجل نسبة اصابه عالية جدا ..    يبدوا ان قصة كورونا كالمسلسلات المكسيكية... URL,Covid Vaccine,Against,0.7488,A_Implicit,,,Yes,0.6366,Neutral,0.6516,2021-08-31 22:51:47+00:00,31/08/2021
2342,شرطة عمان السلطانية تقدمت خطوات كبيره عن باقي المؤسسات الحكومية الخدمية في التحول الالكتروني ونجحت نجاحاً مبهر.. لا يمنع الاستفادة من خبرات  ✔ URL,Digital Transformation,Favor,1.0,,F_Explicit,,No,1.0,Positive,1.0,2021-06-11 06:13:47+00:00,11/06/2021
2344,التعلم عن بعد كان هدفا منشودا واستراتيجيا للدول في ظل التقدم التقني والرقمي .. ولكن إقناع المجتمعات بالتحول والتغيير ليس سهلا  كان يحتاج مثيرا وأسباباً وربما كارثة   فكانت الجائحة التي كسرت القيد وفرضت التحول وأعلنت التغيير وسجلت نقلة نوعية وإيجابية والتشاؤم اصبح شيئا من الماضي .,Digital Transformation,Favor,1.0,,F_Explicit,,No,1.0,Negative,0.598,2020-10-09 21:53:26+00:00,09/10/2020
2346,#شكراً_أبطال_الصحة على الجهود الجبارة والروح الطيبة وحفاوة الترحيب   #تطعيم_كورونا كأنك ضيف في بيتهم  الله يجزاهم كل خير ويعز حكومتنا الرشيدة على كل الخدمات والتسهيلات المقدمة لكل مواطن ومقيم.,Covid Vaccine,Favor,1.0,,F_Explicit,,No,1.0,Positive,1.0,2021-03-03 13:47:01+00:00,03/03/2021
2348,MENTION MENTION خلاصة الخبر خذ الجرعه الثالثه التنشيطيه وانت ساكت عشان نرجع لحياتنا الطبيعيه,Covid Vaccine,Favor,1.0,,F_Explicit,,No,1.0,Neutral,1.0,2021-11-12 02:22:31+00:00,12/11/2021
2349,MENTION اي شخص ضد تطعيم كورونا هذا مريض نفسي ولازم يتعالج خايف من وش بضبط اذا ماطعمت بعدين مين قالك اللقاح اجباري اذا ماتبيه خلاص انطق في بيتك ولا تطلع منه . اللقاح نفسه نفس تطعيم الحج او الانفلونزا الموسمية بس فيه ناس متخلفه غير متعلمه والامعات يصدقونهم ,Covid Vaccine,Favor,1.0,,F_Implicit,,No,0.6259,Positive,0.6509,2021-09-02 08:14:01+00:00,02/09/2021
2352,MENTION اولا واخيرا   نحمد الله على عودة الحياة لطبيعتها ونشكر ايضا القيادة العظيمة على كل ما بذلت من حماية المواطن والمقيم بعد الله وكل من ساهم في تطعيم ضد كورونا وكل الشكر للأبطال الذين ساهموا ايضا وكان الجزء الكبير في تطعيم ضد كورونا,Covid Vaccine,Favor,1.0,,F_Explicit,,No,1.0,Positive,1.0,2021-10-17 01:48:35+00:00,17/10/2021
2353,الحمد لله الذي بنعمته تتم الصالحات لقد حصلت   على شهادة المستوى الخامس لرخصة المعرفة بلا حدود(النظرية والتطبيق في معاييربرنامج مقررات التعليم الإلكتروني)وحصلت على مسمى خبير شمس.في التعليم الالكتروني. والف مبروك لجميع الزميلات على مستوى المملكة  #خبراء_التحول_الرقمي URL,Digital Transformation,Favor,1.0,,F_Explicit,,No,1.0,Positive,0.7454,2020-02-20 18:54:48+00:00,20/02/2020
2357, يحاولون تطعيم الاطفال بلقاح قاتل لا فائدة منه ... لا قانو و لا عرف دولي يجبر الناس على أخذ سمومكم (اللقاح)  غير مطعم و لم يصبني لا كورونا لا دلتا لا اوميكرون و الحمد لله 🙏,Covid Vaccine,Against,1.0,A_Explicit,,,No,1.0,Negative,0.6366,2021-12-10 14:28:51+00:00,10/12/2021
2358, وزارة مميزة بقيادتكم رعاكم الله وبرجالاتها وبتقدمها التقني وتعكس صورة مميزة عن بلادنا وعن التحول الكبير الذي نعيشه في عهد مولاي خادم الحرمين الشريفين وسمو سيدي ولي العهد حفظهم الله . شكراً سمو الأمير على كل ماتقدمونه.,Digital Transformation,Favor,1.0,,F_Explicit,,No,1.0,Positive,1.0,2021-10-23 04:12:42+00:00,23/10/2021
2359,  كل الشكر لـ أ. فقد أبدعت وأثرت ✨ سعدنا جدًا بإستفادتك وحضورك أ.   أطيب تحية من التحول التقني 💜,Digital Transformation,Favor,1.0,,F_Explicit,,No,1.0,Negative,0.421,2022-01-19 09:36:53+00:00,19/01/2022
2360,#وزاره_الصحه  المفروض إسمها وزارة التخبط والنصب  .. الحين كورونا مرض وإنحسر شنو السبب والداعي للتطعيم وتحمل ملايين الدنانير وإرهاق الطاقم الطبي اللي أساسا هو مرهق من طول الفتره وتحمل تطعيم ملايين الوافدين  .. مافي غير سبب واحد وهو التنفيع ... وزير القحه والكورونا طعم نفسك بس,Covid Vaccine,Against,1.0,A_Explicit,,,No,1.0,Negative,0.6128,2020-12-10 13:18:30+00:00,10/12/2020
2363, كل هذا سيتغير بإذن الله  التحول الإلكتروني قادم لا محالة للجميع بلا استثناء,Digital Transformation,Favor,1.0,,F_Explicit,,No,1.0,Positive,1.0,2020-12-23 16:16:47+00:00,23/12/2020
2364,والله انا رافض اخذ حتي الجرعه الاولي  يعني لا زالت صامد ولن اخذ تطعيم لقاح كورونا✋️😬 URL URL,Covid Vaccine,Against,1.0,A_Explicit,,,No,0.6557,Neutral,0.6311,2021-10-24 11:39:16+00:00,24/10/2021
2372,التحول الرقمي في التعليم أكثر بكثير من فقط التعلم عن بعد … أسمع تعريفي للتحول الرقمي في التعليم  وللحديث شرح وبقية URL,Digital Transformation,Favor,1.0,,F_Explicit,,No,1.0,Neutral,1.0,2022-05-09 11:14:54+00:00,09/05/2022
2373,"""ليس من سمع كمن رأى"" سمعت عن التنظيم  في مراكز تطعيم لقاح كوفيد وشفت مقاطع لكن الشي اللي شفته بعيني عظيييم شي مشرف فخرر لكل سعودي تنظيم مبهر موظفين قمة في اللطف والاحترام عمل جبار   الله يجزى كل من شارك وخطط ونظم خير الجزاء ويحفظ بلدنا ويعزنابعزه #لقاح_كوفيد_19 #السعودية_العظمى",Covid Vaccine,Favor,1.0,,F_Explicit,,No,1.0,Positive,1.0,2021-04-16 11:38:55+00:00,16/04/2021
2374,الحمدلله الذي بنعمته تتم الصالحات ..  اخيرا طعمت 🤣                                              #تطعيم_كورونا ,Covid Vaccine,Favor,1.0,,F_Explicit,,No,1.0,Positive,1.0,2021-07-22 16:46:10+00:00,22/07/2021
2375,مهما يكن الجدل حول تطعيم كورونا فإن أثر التطعيم في الدول التي توسعوا بإعطاءه كانت إيجابية في تقليل عدد الحالات التي تحتاج دخول للمستشفى ونقص في الحالات الشديدة,Covid Vaccine,Favor,1.0,,F_Explicit,,No,1.0,Positive,1.0,2021-04-24 12:22:17+00:00,24/04/2021
2377,بكرا آخذ اللقاح ان شاءالله...لسه سارية المفعول هبة الصور عند التطعيم 😂🤣🤦‍♀️ #كوفيد_19  #تطعيم_كورونا,Covid Vaccine,Favor,1.0,,F_Explicit,,Yes,0.7131,Neutral,0.6311,2021-02-17 17:05:02+00:00,17/02/2021
2378,من بعد التحول الالكتروني اللي صار  -نوعا ما-توقعت نتحسن في تطوير المنظومة التعليم #  توقعت نقلل ورقيات ونركز استراتيحيات توقعت نقلل كميات ونركز جودة  توقعت نقلل تلقين ونزيد تجربة الطالب  اللي حصل زادت أحمال المعلمين  وكل يوم قرار يثقل كاهل المعلم. URL,Digital Transformation,Favor,1.0,,F_Explicit,,No,1.0,Positive,0.6291,2021-12-23 06:00:20+00:00,23/12/2021
2379,بغيناه عون طلع فرعون كانت وفيات دار رعاية المسنين معدومة من كورونا ابتدأ التطعيم للنزل وتبدأ الوفيات.  من المفترض أن يؤدي تطعيم الأشخاص إلى تقليل وفيات أو إنهائها😰 لكن في مجلس العموم   تم الإبلاغ عن حدوث مثل هذه الوفيات فقط بعد أن بدأ السكان في تلقي لقاحات فيروس كورونا مجرد صدفة URL,Covid Vaccine,Against,1.0,A_Explicit,,,No,0.7204,Negative,0.5898,2021-01-13 05:27:45+00:00,13/01/2021
2380,"لم تسجِّل بعد!🤔 لا تفوِّت محاضرتنا الشيقة والقيّمة بمعلوماتها  على #ويبينار_التحول_التقني  بعنوان ""تحليل البيانات باستخدام POWER BI""  انتظرونا غدًا 🤩  سجِّل الآن   URL URL",Digital Transformation,Favor,1.0,,F_Explicit,,No,1.0,Positive,0.7527,2022-02-01 11:00:00+00:00,01/02/2022
2382,#تطعيم_كورونا تم اليوم التطعيم وبدون ألم أو مضاعفات ولله الحمد,Covid Vaccine,Favor,1.0,,F_Explicit,,No,1.0,Positive,1.0,2021-01-01 09:10:22+00:00,01/01/2021
2384, انا لو ادري باخذ تطعيم وبعدها تسوون عليهم حظر اقسم بالله مااخذه شنو فايده اخذ لقاح وبعدها حاكرنا بالبيت ؟ دمرتنا وتعبت نفسياتنا اقسم بالله,Covid Vaccine,None,0.5,,,Not clear,No,1.0,Negative,1.0,2021-04-17 13:57:12+00:00,17/04/2021
2387,MENTION MENTION لما جتني كورونا حمدلله شفتها اعراض نزله برد قادره على مقاومتها ف ليش احط لنفسي تطعيم يقيني من مرض انا بحول الله قدرت عليه !,Covid Vaccine,Against,1.0,A_Explicit,,,No,1.0,Neutral,0.6782,2021-07-16 15:18:54+00:00,16/07/2021
2388,MENTION MENTION  هل من اخذ تطعيم ضد الجدري والسحايا وغيره من الامراض تتم اصابتهم بالمرض اذا لا ... اجل تطعيم ولقاح كورونا ليش من يأخذ جميع الجرعات يصاب بفيروس كورونا,Covid Vaccine,Against,0.5925,A_Implicit,,,No,1.0,Neutral,1.0,2021-05-26 23:14:07+00:00,26/05/2021
2389,MENTION تطعيم كورونا الجيني  لكن متنكر بالانفلونزا 😁😂 #لا_للتطعيم_الاجباري  #لن_امتثل,Covid Vaccine,Against,1.0,A_Explicit,,,Yes,1.0,Negative,0.6509,2021-09-30 20:58:16+00:00,30/09/2021
2391,ان شاء الله الجميع يتطعم وترجع الحياة #تطعيم_كورونا,Covid Vaccine,Favor,1.0,,F_Explicit,,No,1.0,Neutral,0.689,2020-12-24 16:52:27+00:00,24/12/2020
2392, اكرر...كل مااشوف دعايه حق تطعيم...ومشاهير تاخذ لقاح جدام الكاميرات يزيد شكي بفاعليتها اصلا... ثانيا تطعيمكم يقول مايمنع الاصابه ولا يمنع ان اصيب غيري ولا قاعد يفيد احد لان الكل محبوس ببيته بالحظر لو فيه فايده جان اللي ماخذ تطعيم مايطبق عليه ال,Covid Vaccine,Against,1.0,A_Explicit,,,No,1.0,Neutral,0.6981,2021-04-06 16:58:34+00:00,06/04/2021
2393,MENTION MENTION انا اتوقع كل هذي الاعراض المذكوره على انها اعراض الفايروس هيهي   بالحقيقه هي الاعراض والامراض اللي ظهرت او ستظهر بسبب تطعيم لقاحات كورونا الحاليه  فجعلوا هذي النتيجه هي اعراض (مرضهم ووباءهم) الجديد المزعوم,Covid Vaccine,Against,1.0,A_Explicit,,,No,1.0,Neutral,0.7196,2021-11-10 17:31:33+00:00,10/11/2021
2394, هو عنده كل مشاكل معوقات التحول الرقمي كلها مش جزء منها و برضو عاوز يعمل تحول رقمي😂😂🙈,Digital Transformation,Against,0.7447,A_Explicit,,,No,1.0,Negative,0.5863,2021-10-15 17:15:43+00:00,15/10/2021
2395,MENTION اكيد ماخذة تطعيم مرتين ومع هذا حاشتها كورونا وماتت    و اكيد وزارة الصحة ماراح تصرح بهالشي !!👍👍❌❌❌,Covid Vaccine,Against,0.7352,A_Implicit,,,Yes,0.6259,Negative,0.6509,2021-07-17 19:31:09+00:00,17/07/2021
2397,MENTION MENTION عشان تخافين وتاخذين الثانية  بعدين يصرحون مثل البحرين إن اللي في العناية وحالتهم حرجة هم اللي ماأخذوا الجرعة التنشيطية (الثالثة) وبطتنا بطة بطن بطتكم #لا_للتطعيم_الاجباري82 #لا_للتطعيم_الاجباري81 #لا_للتطعيم_الاجباري80,Covid Vaccine,Against,1.0,A_Explicit,,,Yes,0.6128,Negative,0.6128,2021-08-02 17:50:57+00:00,02/08/2021
2398,التحول الإلكتروني الكامل لأنظمة وزارة الصحة خدم المريض والطاقم الطبي وقلل الأخطاء بشكل كبير لكن ظهرت مشكلة خصوصية المريض.  هل يحق للمريض المطالبة بحذف ملفه بشكل نهائي من نظام المستشفى؟  أو طلب إخفاء ملفه إلا عن طبيبه المباشر؟,Digital Transformation,Favor,1.0,,F_Explicit,,No,1.0,Positive,1.0,2021-01-21 17:00:11+00:00,21/01/2021
2401,اللقاح راح يوصل خلال ٣ أشهر ... ونخلص تطعيم للمواطنين خلال ٦ اشهر يعني باذن الله شهر ٩ تقدرون تسافرون وناخذ التطعيم كل سنه لان كورونا هانم بتعيش معانا نفس الانفلونزا,Covid Vaccine,Favor,1.0,,F_Implicit,,No,1.0,Positive,0.6509,2020-11-11 06:05:34+00:00,11/11/2020
2402,المفروض كل مراكز الصحة يصير فيها تطعيم كورونا علشان نخلص اسرع ويشتغلون شفتات بالويكند,Covid Vaccine,Favor,1.0,,F_Explicit,,No,1.0,Positive,0.6509,2021-01-17 10:25:38+00:00,17/01/2021
2403,حازت مؤسسة حمد الطبية على جائزة  مايكروسوفت للتحول الرقمي خلال حفل خاص أقيم بهذه المناسبة لتكريم المؤسسات المتميزة والمبتكرة على مستوى دولة قطر في التحول الرقمي. . URL URL,Digital Transformation,Favor,1.0,,F_Explicit,,No,1.0,Positive,1.0,2019-07-17 05:01:04+00:00,17/07/2019
2405,MENTION MENTION هل راح تنتهي مسرحية كورونا بدون تطعيم القلة الرافضه ؟! بالسعودية صار مداهمة لغير المطعمين بمقر عملهم وعطوهم بالإجبار,Covid Vaccine,Against,0.7467,A_Explicit,,,No,1.0,Neutral,0.6729,2021-09-03 17:20:06+00:00,03/09/2021
2406, تساقط الشعر  و تأخر الدورة من بعد تطعيم كورونا الكثيرات يشتكون 😩,Covid Vaccine,Against,0.7488,A_Implicit,,,No,1.0,Negative,0.6838,2021-12-03 11:49:09+00:00,03/12/2021
2407,MENTION  المشكله ماندري نكلمهم طب او نكلمهم دين  أو نكلمهم منطق  شنو يبون بالضبط ماندري تطعيم والله ماراح نطعم وفيلم كورونا خلاص انكشف اكتفوا بالي طعموا وسكروا هالملف ترا مصخت.,Covid Vaccine,Against,1.0,A_Explicit,,,No,1.0,Negative,0.6192,2021-08-07 15:23:53+00:00,07/08/2021
2408, وكان فيه انسانة ما اخذت التطعيم وجالسة مع ناس مو مطعمين جتها كورونا وظهرت عليها الأعراض اول وحدة والباقي لا  قصة ثانية وحدة من جماعتنا مااخذت تطعيم جا للي معها بالبيت كورونا وخالطتهم وقامت فيهم وتطبخ لهم  وتعتني فيهم بدون كمام بدون شي ولا جاه,Covid Vaccine,None,1.0,,,Not clear,No,1.0,Neutral,0.5658,2021-04-25 20:00:56+00:00,25/04/2021
2409,كورونا صار له سنة ولي الحين الناس تؤمن بالمؤامرة وان الدكاترة اهما اللي قاعد يذبحون الناس مو المرض وان التطعيم خطة للسيطرة على العالم 😫  زين ليش ما سيطرو علينا بالتطعيمات اللي ناخذها من أول يوم بحياتنا ليش أصنع فيروس عشان أصنع تطعيم أتحكم فيه بالناس  قوى الشر ما تعرف تخطط! 😅,Covid Vaccine,Favor,0.5781,,F_Implicit,,No,0.6366,Negative,0.7118,2021-03-19 10:38:38+00:00,19/03/2021
2410, بعد مرور عام  #عام_على_التعليم_عن_بعد اثبتت وزارة التعليم بدعم القيادة الرشيدة بانها تتحدى الصعوبات في اداء رسالتها واثبتوا منسوبيها طلبة ومعلمين  جاهزيتهم من خلال التحول الالكتروني,Digital Transformation,Favor,1.0,,F_Explicit,,No,1.0,Positive,1.0,2021-03-08 17:16:12+00:00,08/03/2021
2411,#زاوية_من_عمان  الحمد لله هذا بالفعل هو عصر السرعة ويجب على جميع الجهات الاسراع في التحول الإلكتروني وتحقيق أهداف رؤية #عمان_2040  وكلنا شركاء لتحقيق هذه الأهداف. #تغريدة_لوطني_عُمان,Digital Transformation,Favor,1.0,,F_Explicit,,No,1.0,Positive,0.5854,2020-12-14 10:43:46+00:00,14/12/2020
2412,دبي كانت سباقة في تعزيز مكانتها كمدينة عالمية رائدة في الابتكار والسلامة والأمن بإطلاق صاحب السمو الشيخ محمد بن راشد آل مكتوم لاستراتيجية دبي للأمن الالكتروني تماشياً مع التحول الذكي الذي تشهده الإمارة.   ,Digital Transformation,Favor,1.0,,F_Explicit,,No,1.0,Positive,0.7,2021-04-05 12:59:22+00:00,05/04/2021
2413,تكرار انقطاع خدمة بوابة الدفع الإلكتروني Online Payment Gateway لا يساعد في الثقة بالخدمة ويؤثر سلبا على حراك التحول الإلكتروني في السلطنة,Digital Transformation,Against,0.7562,A_Explicit,,,No,1.0,Negative,1.0,2020-09-25 06:59:58+00:00,25/09/2020
2414, مهندس مشكلة بعض مواقع الدولة ماخذه جوائز في التحول الإلكتروني وهي تأخير في معاملات فقط بهرجه اعلام وتصوير,Digital Transformation,Against,1.0,A_Explicit,,,No,1.0,Negative,1.0,2021-03-06 16:21:52+00:00,06/03/2021
2416,نبي تطعيم كورونا للأطفال 💔😢,Covid Vaccine,Favor,1.0,,F_Explicit,,No,1.0,Negative,0.7087,2021-04-16 13:52:46+00:00,16/04/2021
2417,#لا_للتطعيم_الاجباري١٨  صح لسانكم شوفو كيف تحمون نفسكم من كورونا بدون تطعيم 🔥🔥🔥 URL,Covid Vaccine,Favor,0.5781,,F_Implicit,,No,1.0,Negative,0.6077,2021-05-31 10:04:37+00:00,31/05/2021
2419,#هيئة_الحكومة_الرقمية  قرار يدعم رحلة التمكين في التحول الرقمي من خلال تبني نماذج فعالة ومبتكرة والاستثمار  الامثل للتقنيات والمواهب وتطوير القدرات الرقمية👏🏻  “معاً نحو بناء مستقبل رقمي مزدهر 🇸🇦🇸🇦” #التحول_الرقمي #وطن_طموح_وطن_رقمي URL,Digital Transformation,Favor,1.0,,F_Explicit,,No,1.0,Positive,1.0,2021-03-10 10:57:30+00:00,10/03/2021
2420,  كل منظومة التحول الإلكترونى حاليا كفائتها منخفضه للغايه الماكينات إما أنها خارج الخدمه أو أنها خاليه من النقود والتعامل تليفونيا مع موظفي خدمة العملاء كارثه أخرى فقليل منهم الذي يفهم وظيفته وإذا تحتم عليك الذهاب للبنك فقد ضاعت ثلاثة ,Digital Transformation,Against,0.7428,A_Explicit,,,No,1.0,Negative,1.0,2020-07-26 07:40:20+00:00,26/07/2020
2421,العجيب أنه في الوقت الذي تحول فيه جهة حكومية خدماتها إلى خدمات إلكترونية و رائدة في هذا التحول  إلا أنها كذلك تتوسع عمرانيا بشكل مبالغ فيه. تذهب لتنجز معاملة المباني شبه فاضية 🤷🏻‍♂️ الشائع أنه مع التحول الإلكتروني يقل التوسع العمراني 🙄,Digital Transformation,None,0.7372,,,Not clear,No,1.0,Positive,0.6342,2021-02-03 04:00:48+00:00,03/02/2021
2425,“لا تهلعوا”… تطعيم أولادكم لا يختلف عن لقاحات #كورونا   ,Covid Vaccine,Favor,1.0,,,,No,1.0,Neutral,0.525,2021-04-09 06:18:36+00:00,09/04/2021
2427, الله يعز دولتنا ويحفظ ولاة امرنا حجزت تطعيم لقاح فايزر ورحت تطعمت ولله الحمد بل اعرف ان دولتنا هي الدوله الوحيده في العالم اللي تأمن علاجات وادويه لبعض الامراض تصل لنص مليون وتعطيها للمواطن بالمجان اللهم لك الحمد حتى ترضى,Covid Vaccine,Favor,1.0,,F_Explicit,,No,1.0,Positive,1.0,2021-04-23 22:50:36+00:00,23/04/2021
2428,MENTION 🤨يامسلم من يوم الله خلقنا واحنا نتطعم ولا ندري جات على  تطعيم كورونا روح خذ التطعيم وانتا ساكت 🤣🤪🏃🏽‍♀️🏃🏽‍♀️,Covid Vaccine,Favor,1.0,,F_Explicit,,Yes,0.6943,Neutral,0.693,2021-06-04 18:53:07+00:00,04/06/2021
2430,تحتل المملكة المرتبة ال ٢٩ عالميا في مؤشر الامم المتحدة لتطور الحكومة الالكترونية ٢٠٢٠  متقدمة على الكثير من الدول المتقدمة و الاهم من ذلك انها الدولة صاحبة اسرع تقدم في هذا المؤشر  حيث يعد التحول الرقمي الالكتروني احد ابرز مكونات رؤية ٢٠٣٠. شكرا لجعل الحياة افضل و اسهل,Digital Transformation,Favor,1.0,,F_Explicit,,No,1.0,Positive,1.0,2021-03-18 12:50:22+00:00,18/03/2021
